{"$schema":"https://json-schema.org/draft/2020-12/schema","type":"object","required":["published_at","target","graded","pending"],"properties":{"published_at":{"type":"string"},"target":{"type":"string"},"graded":{"type":"array","items":{"type":"object","required":["reference_period","badge","forecast","as_of","actual","error","release_date"],"properties":{"reference_period":{"type":"string"},"badge":{"type":"string"},"forecast":{"type":"number"},"as_of":{"type":"string"},"actual":{"type":"number"},"error":{"type":"number"},"release_date":{"type":"string"}}}},"pending":{"type":"array","items":{"type":"object","required":["reference_period","badge","forecast","as_of","actual"],"properties":{"reference_period":{"type":"string"},"badge":{"type":"string"},"forecast":{"type":"number"},"as_of":{"type":"string"},"actual":{"type":"null"}}}},"leaderboard":{"type":"object","required":["basis","window","min_n_for_weights","weights_earned","stats","rows"],"additionalProperties":false,"properties":{"basis":{"type":"string"},"window":{"type":"integer"},"min_n_for_weights":{"type":"integer"},"weights_earned":{"type":"boolean"},"stats":{"type":"object","additionalProperties":{"type":"object","required":["n","mae_pp","bias_pp"],"additionalProperties":false,"properties":{"n":{"type":"integer"},"mae_pp":{"type":["number","null"]},"bias_pp":{"type":["number","null"]}}}},"rows":{"type":"array","items":{"type":"object","required":["reference_period","release_date","actual_sa_mom_pct","forecasts"],"additionalProperties":false,"properties":{"reference_period":{"type":"string"},"release_date":{"type":"string"},"actual_sa_mom_pct":{"type":"number"},"forecasts":{"type":"object","additionalProperties":{"type":"object","required":["value","error","converted"],"additionalProperties":false,"properties":{"value":{"type":"number"},"error":{"type":"number"},"converted":{"type":"boolean"}}}}}}}}},"last_print_components":{"oneOf":[{"type":"null"},{"type":"object","required":["reference_period","release_date","rows"],"additionalProperties":false,"properties":{"reference_period":{"type":"string"},"release_date":{"type":"string"},"rows":{"type":"array","items":{"type":"object","required":["component","label","weight","forecast_nsa_mom_pct","actual_nsa_mom_pct","miss_contribution_pp"],"additionalProperties":false,"properties":{"component":{"type":"string"},"label":{"type":"string"},"weight":{"type":"number"},"forecast_nsa_mom_pct":{"type":"number"},"actual_nsa_mom_pct":{"type":"number"},"miss_contribution_pp":{"type":"number"}}}}}}]}}}
