{
  "published_at": "2026-10-19T12:56:43Z",
  "target": "NFP",
  "graded": [
    {
      "reference_period": "2026-07",
      "badge": "LIVE",
      "forecast": 137.0,
      "as_of": "2026-07-30",
      "actual": -23.0,
      "error": 160.0,
      "release_date": "2026-08-07"
    },
    {
      "reference_period": "2026-08",
      "badge": "LIVE",
      "forecast": 31.0,
      "as_of": "2026-09-03",
      "actual": 162.0,
      "error": -131.0,
      "release_date": "2026-09-04"
    },
    {
      "reference_period": "2026-09",
      "badge": "LIVE",
      "forecast": 91.0,
      "as_of": "2026-10-01",
      "actual": 29.0,
      "error": 62.0,
      "release_date": "2026-10-02"
    }
  ],
  "pending": [
    {
      "reference_period": "2026-10",
      "badge": "LIVE",
      "forecast": 67,
      "as_of": "2026-10-19",
      "actual": null
    }
  ]
}
